entry,protein names,organism
A0A068UI65,Uncharacterized protein,Coffea canephora (Robusta coffee)
A0A2P9B8Z0,"Holo-(Acyl-carrier protein) synthase, putative",Plasmodium sp. gorilla clade G1
A0A484CWB0,Uncharacterized protein,Perca flavescens (American yellow perch) (Morone flavescens)
A0A3B3IEV3,Uncharacterized protein,Oryzias latipes (Japanese rice fish) (Japanese killifish)
A0A455BXN8,endoribonuclease YbeY isoform X4,Physeter macrocephalus (Sperm whale) (Physeter catodon)
A0A6J2S0N2,endoribonuclease YbeY,Cottoperca gobio (Frogmouth) (Aphritis gobio)
A0A3G2I6N4,Endoribonuclease YbeY (EC 3.1.-.-),Buchnera aphidicola subsp. Rhopalosiphum maidis
A0A4D6MHA6,Putative rRNA maturation factor,Vigna unguiculata (Cowpea)
A0A2P6Q141,"Putative endoribonuclease YbeY, metalloprotease catalytic domain, predicted",Rosa chinensis (China rose)
A0A437C774,Uncharacterized protein,Oryzias javanicus (Javanese ricefish) (Aplocheilus javanicus)
A0A3P8RYR5,YbeY metalloendoribonuclease,Amphiprion percula (Orange clownfish) (Lutjanus percula)
A0A6P6TV56,"endoribonuclease YBEY, chloroplastic-like",Coffea arabica (Arabian coffee)
A0A3L6SRX5,Uncharacterized protein,Panicum miliaceum (Proso millet) (Broomcorn millet)
A0A3B5MDD5,YbeY metalloendoribonuclease,Xiphophorus couchianus (Monterrey platyfish)
G7I278,Haloacid dehalogenase-like hydrolase (Putative sugar-phosphatase) (EC 3.1.3.23),Medicago truncatula (Barrel medic) (Medicago tribuloides)
A0A2P6TVV2,Haloacid dehalogenase-like hydrolase family isoform 2,Chlorella sorokiniana (Freshwater green alga)
A0A2S3HRW5,Uncharacterized protein,Panicum hallii
A0A2T7F3X6,Uncharacterized protein,Panicum hallii var. hallii
M7YQS4,Uncharacterized protein,Triticum urartu (Red wild einkorn) (Crithodium urartu)
A0A103XFS5,Cof protein,Cynara cardunculus var. scolymus (Globe artichoke) (Cynara scolymus)
A0A3P9CA67,YbeY metalloendoribonuclease,Maylandia zebra (zebra mbuna)
A0A2P9BSG5,"Holo-(Acyl-carrier protein) synthase, putative",Plasmodium sp. gorilla clade G2
A0A060S102,"Cof-like hydrolase, had-superfamily, subfamily iib (Haloacid dehalogenase-like hydrolase, putative)",Plasmodium reichenowi
A0A6D2W0U7,YBEY isoform 1 (YBEY isoform 5) (YBEY isoform 8),Pan troglodytes (Chimpanzee)
I1HYX9,Uncharacterized protein,Brachypodium distachyon (Purple false brome) (Trachynia distachya)
A0A6P5C1D0,putative ribonuclease,Bos indicus (Zebu)
A9SD07,Predicted protein,Physcomitrium patens (Spreading-leaved earth moss) (Physcomitrella patens)
A0A2K2A746,Uncharacterized protein,Populus trichocarpa (Western balsam poplar) (Populus balsamifera subsp. trichocarpa)
A0A6J1FDM0,"endoribonuclease YBEY, chloroplastic",Cucurbita moschata (Winter crookneck squash) (Cucurbita pepo var. moschata)
A0A6D2WAB1,YBEY isoform 1 (YBEY isoform 6) (YBEY isoform 8),Pongo abelii (Sumatran orangutan) (Pongo pygmaeus abelii)
A0A5F5PQ83,YbeY metalloendoribonuclease,Equus caballus (Horse)
W7TL95,Cof-like hydrolase,Nannochloropsis gaditana
K8Z3C9,Cof-like hydrolase,Nannochloropsis gaditana (strain CCMP526) (Green microalga) (Microchloropsis gaditana)
A0A1D3UAH9,"Haloacid dehalogenase-like hydrolase, putative",Plasmodium ovale (malaria parasite P. ovale)
A0A1A8WZG7,"Haloacid dehalogenase-like hydrolase, putative (HAD2)",Plasmodium ovale curtisi
A0A1A8YNG5,"Holo-[acyl-carrier-protein] synthase, putative (ACPS)",Plasmodium ovale wallikeri
M4AKQ0,Uncharacterized protein,Xiphophorus maculatus (Southern platyfish) (Platypoecilus maculatus)
A0A2G2VAC2,Uncharacterized protein,Capsicum baccatum (Peruvian pepper)
A0A2G3BRV1,Uncharacterized protein,Capsicum chinense (Scotch bonnet) (Bonnet pepper)
A0A2A9MBR7,Cof family hydrolase subfamily protein,Besnoitia besnoiti
A0A1A8VS93,"Haloacid dehalogenase-like hydrolase, putative (Haloacid dehalogenase-like hydrolase, putative (HAD1))",Plasmodium malariae
A0A1J1HFQ1,"Haloacid dehalogenase-like hydrolase, putative",Plasmodium relictum
K6VIA6,Hydrolase,Plasmodium cynomolgi (strain B)
A0A1J7HNN4,Uncharacterized protein,Lupinus angustifolius (Narrow-leaved blue lupine)
A0A087GRN4,Uncharacterized protein,Arabis alpina (Alpine rock-cress)
K8F029,Cof-like hydrolase,Bathycoccus prasinos
L0AYC7,Uncharacterized protein,Theileria equi strain WA
A0A1R4AA11,"Holo-(Acyl-carrier protein) synthase, putative",Babesia microti (strain RI)
A0A6P7RCN7,endoribonuclease YbeY isoform X2,Mus caroli (Ryukyu mouse) (Ricefield mouse)
A0A5P1EZ15,Uncharacterized protein,Asparagus officinalis (Garden asparagus)
A0A2I0LL51,Putative ybeY metallopeptidase (Putative) (Fragment),Columba livia (Rock dove)
A0A1J6IBB6,Uncharacterized protein,Nicotiana attenuata (Coyote tobacco)
A0A061GJV0,Haloacid dehalogenase-like hydrolase family protein isoform 3,Theobroma cacao (Cacao) (Cocoa)
A0A1B1DWN2,Haloacid dehalogenase-like hydrolase,Plasmodium coatneyi
K3XFT6,Uncharacterized protein,Setaria italica (Foxtail millet) (Panicum italicum)
A0A166HV40,Uncharacterized protein,Daucus carota subsp. sativus (Carrot)
A0A2P9C2R5,Haloacid dehalogenase-like hydrolase,Plasmodium gaboni
A0A151UGC3,Putative metalloprotease ACIAD3160 family (Fragment),Cajanus cajan (Pigeon pea) (Cajanus indicus)
M0SJI3,Uncharacterized protein,Musa acuminata subsp. malaccensis (Wild banana) (Musa malaccensis)
A0A1S3T949,uncharacterized protein LOC106753016 isoform X2,Vigna radiata var. radiata (Mung bean) (Phaseolus aureus)
A0A0B0P8Y2,Phosphatase YidA,Gossypium arboreum (Tree cotton) (Gossypium nanking)
D8LI88,Haloacid dehalogenase-like hydrolase,Ectocarpus siliculosus (Brown alga) (Conferva siliculosa)
B8C7J1,Uncharacterized protein,Thalassiosira pseudonana (Marine diatom) (Cyclotella nana)
B7FRR9,Predicted protein (Fragment),Phaeodactylum tricornutum (strain CCAP 1055/1)
E9B5B9,Uncharacterized protein,Leishmania mexicana (strain MHOM/GT/2001/U1103)
W5MR38,YbeY metalloendoribonuclease,Lepisosteus oculatus (Spotted gar)
A0A061DD44,Probable rRNA maturation factor,Babesia bigemina
A0A090MAF4,Endoribonuclease YbeY,Ostreococcus tauri
Q4N8Y6,Uncharacterized protein,Theileria parva (East coast fever infection agent)
F7GEX4,Uncharacterized protein,Monodelphis domestica (Gray short-tailed opossum)
G1KDH9,Uncharacterized protein,Anolis carolinensis (Green anole) (American chameleon)
D7STJ2,Uncharacterized protein,Vitis vinifera (Grape)
A0A088RPB9,Uncharacterized protein,Leishmania panamensis
A0A2T7IE30,Bromo domain-containing protein,Theileria orientalis
J4C7D2,Uncharacterized protein,Theileria orientalis strain Shintoku
A0A0D9VDZ1,Uncharacterized protein,Leersia perrieri
A0A0D9R4C1,YbeY metalloendoribonuclease,Chlorocebus sabaeus (Green monkey) (Cercopithecus sabaeus)
M1UTF5,Uncharacterized protein,Cyanidioschyzon merolae (strain 10D) (Red alga)
C1EHG2,Uncharacterized protein (Fragment),Micromonas commoda (strain RCC299 / NOUM17 / CCMP2709) (Picoplanktonic green alga)
A0A3P8WGE7,YbeY metalloendoribonuclease,Cynoglossus semilaevis (Tongue sole)
A0A6I9TBE6,uncharacterized protein LOC105164715,Sesamum indicum (Oriental sesame) (Sesamum orientale)
U3JN64,YbeY metalloendoribonuclease,Ficedula albicollis (Collared flycatcher) (Muscicapa albicollis)
